Name,Description,Latitude,Longitude,InfoURL,ImageURL
UCSB,A great university located along the California coast!,34.416929,-119.845991,"https://en.wikipedia.org/wiki/University_of_California, _Santa_Barbara ",https://www.history.ucsb.edu/wp-content/uploads/La goonFall20141.jpg
Old Mission Santa Barbara,A beautiful historic mission that has existed since 1786.,34.438207,-119.714088,https://www.santabarbaramission.org/mission-history ,https://en.wikipedia.org/wiki/Mission_Santa_Barbara#/media/File:Mission_Santa_Barbara01.jpg 
United States Botanic Gardens,Stunning gardens which include rare plants from around the world.,38.888186,-77.012875,https://en.wikipedia.org/wiki/United_States_Botanic_Garden ,https://images.app.goo.gl/mH38XahC7kfZQwsZ9 
Olmsted Island Overlook,Rocky hiking trail leading to an amazinbg waterfall view.,38.996727,-77.251955,https://www.nps.gov/choh/learn/news/olmsted-island-overlook-open.htm,https://images.app.goo.gl/NdpYm1BoPh498spB9 
Twin Peaks Overlook,The greatest view in San Francisco with ample space to relax.,37.753117,-122.447411,https://en.wikipedia.org/wiki/Twin_Peaks_(San_Francisco) ,https://images.app.goo.gl/rX7YQr4TD51VXxdC7
FedExField,Home stadium of the Washington Footbal Team (the best team in the NFL).,38.907665,-76.864545,https://en.wikipedia.org/wiki/FedExField ,https://images.app.goo.gl/dFt6eMafuEh3gbXJ6 